,parentId,authorDisplayName,replyComment,publishedAt,likeCount
0,Ugxg2ixy4JU8FTx3HC94AaABAg,валентин шаровара,О,2022-05-08T09:57:10Z,0
1,Ugxg2ixy4JU8FTx3HC94AaABAg,Нип Пель,"Э! Короче, это! Охринел?! Давай, кароч, это. Какчай, кароч. На укр.  Это.😊",2022-05-02T22:44:57Z,0
2,Ugxg2ixy4JU8FTx3HC94AaABAg,Любов Діденко,Калуш ти найккращій співак вибачаюсь  я не вмію писати на Укр.Мові  тому що я говорю по російськи але я народилася в Україні мені сім років і я обожнюю твої пісні для мене ти топ,2022-05-02T15:01:01Z,0
3,Ugxg2ixy4JU8FTx3HC94AaABAg,Milana-Eda Alkan,Вы крутые!!! Первые кого я буду слушать… украинские ребята !!,2022-04-30T09:34:24Z,0
4,Ugxg2ixy4JU8FTx3HC94AaABAg,Наталия Гуляницкая,Це щось неймовірне,2022-04-22T18:47:36Z,0
5,UgzJiljzwmsb9WHsCB94AaABAg,Україна Переможе,Удачі,2022-03-10T11:31:44Z,0
6,UgyDqYam5VJLZwYiozV4AaABAg,Herman Kompaniiets,Ми ще довго будемо відригувати вашу братерську любов православну...,2022-03-12T21:06:06Z,3
7,UgwfExUg5IDV7khfylF4AaABAg,Vera Zadorozhnyaya,"Дякуємо Польщі ,,українці це ніколи
Не забудуть вашу підтримку!!",2022-04-29T21:45:57Z,2
8,UgwfExUg5IDV7khfylF4AaABAg,Not Defined,СЛАВА УКРАЇНІ🇺🇦🇺🇦🇺🇦🇺🇦,2022-04-12T16:36:47Z,2
9,UgwfExUg5IDV7khfylF4AaABAg,Аніта Доманська,СЛАВА УКРАЇНІ🇺🇦🇺🇦🇺🇦🇺🇦,2022-04-03T09:49:55Z,2
10,UgwfExUg5IDV7khfylF4AaABAg,Herman Kompaniiets,"Дякуємо брати поляки!

Героям слава!",2022-03-08T20:39:50Z,6
11,UgzR-UH8hww76FtiZTh4AaABAg,Huilovtsam_Kaput!,"Манкурт, ти огидний!",2022-04-22T20:41:21Z,0
12,UgzR-UH8hww76FtiZTh4AaABAg,Herman Kompaniiets,До Києва його або до Харкова!,2022-03-08T20:41:25Z,0
13,UgzR-UH8hww76FtiZTh4AaABAg,Elijah Smith,"чувак, не позорся",2022-03-08T03:07:53Z,4
14,UgxY6iGoXyl4fU8JFSV4AaABAg,Олег Давидов,@mmacalina той хто проснувся тут свій час не гає...а ми ще шукаємо,2022-02-14T10:48:33Z,0
15,UgxY6iGoXyl4fU8JFSV4AaABAg,mmacalina,ми вже проснулися. А ви ще спите,2022-02-14T10:42:39Z,1
16,Ugxu0OPXyynxzaJgZUJ4AaABAg,Julia Tkachenko,сопілка,2022-02-19T20:50:52Z,0
17,Ugz7Wh5GUMLZ2b8IVtd4AaABAg,Владимир Яцентюк,"Вот как раз Калуш и Вова из Львова это да похоже ) одинаково безпонтово звучит, а вот Skofka top , он один вытягивает все песни , когда начинается куплет Калуша мне стает стыдно его слушать , хочу сразу перемотать ....",2022-02-18T21:23:16Z,0
18,UgxpqFuYZsVw1NQvMAd4AaABAg,Кристина Мася,"Я розумію, про що кажу, мій рік навчався 1991",2022-02-01T07:36:37Z,0
19,UgxpqFuYZsVw1NQvMAd4AaABAg,Кристина Мася,"Клип, не в  тему! Это  на чистоту!",2022-02-01T07:28:04Z,0
20,UgycQLxTbk6ZEu0hWBt4AaABAg,Кристина Мася,Люды як караблі,2022-02-01T07:33:47Z,0
21,UgycQLxTbk6ZEu0hWBt4AaABAg,Кристина Мася,"На чистоту, на пикапе , Кузьму послушай и поймёшь о чём я говорю!",2022-02-01T07:31:23Z,0
22,Ugypx0rGK3LCirHekzZ4AaABAg,Herman Kompaniiets,Київське море. Вишгород.,2022-02-01T21:40:41Z,0
23,UgxR_OjFYwBeqn3ljt94AaABAg,Larysa Cherner,@Music 4 life 😌,2022-01-10T06:58:10Z,0
24,UgxR_OjFYwBeqn3ljt94AaABAg,Music 4 life,@Larysa Cherner 😀,2022-01-10T06:05:41Z,0
25,UgxR_OjFYwBeqn3ljt94AaABAg,Larysa Cherner,"Чудова панама. Як у молодого Ліама Галлагера, а він завжди був іконою стилю :)",2022-01-09T21:05:46Z,1
26,UgwcXcu65VHJmgN1Ufp4AaABAg,Dmitry USA,"Так слухай дальше свій бтс, чорт",2022-01-08T22:23:59Z,0
27,UgwcXcu65VHJmgN1Ufp4AaABAg,Sun Shade,"Ще варто б текс перекласти з мови оригінал, цікаво чи є схожість",2022-01-04T11:20:01Z,0
28,UgxrgpprPtEOudoHCTJ4AaABAg,Владимир Яцентюк,"Skofka это тот кто сам делает в 100 раз круче , зачем тянуть Калуша за уши ?..",2022-02-18T21:14:04Z,0
29,UgwWoKT5xYO2XtycTtF4AaABAg,Herman Kompaniiets,Так,2022-01-15T20:41:57Z,0
30,Ugz5Hm4OhfNEutRpfSp4AaABAg,Павел Меликаев,Підтримаю ідею 🇺🇦💪🏼,2022-03-26T18:10:14Z,1
31,Ugz5Hm4OhfNEutRpfSp4AaABAg,Valentin Karaman,"Залакайте, этот комментарий, про военных, пусть увидят",2022-02-23T18:45:44Z,2
32,Ugz5Hm4OhfNEutRpfSp4AaABAg,Сергей Леванчук,так,2022-02-19T20:40:11Z,3
33,Ugz5Hm4OhfNEutRpfSp4AaABAg,Петро Попович,Підтримую! Дуже цікаво!,2022-02-12T11:28:24Z,7
34,Ugz5Hm4OhfNEutRpfSp4AaABAg,dagny taggart,Цікава ідея,2022-02-11T12:20:56Z,7
35,UgySbNcEoVGWQzF2HYp4AaABAg,юра юдин,героям слава,2022-04-17T14:19:06Z,0
36,UgxvGLEzfuLSvQN7Bzp4AaABAg,KALUSH,вдячні) чули цілий альбом?,2021-11-23T17:46:54Z,0
37,UgxLD-VbUsV1l5IU2it4AaABAg,TeSs,@KALUSH звичайно),2021-11-23T17:56:24Z,0
38,UgxLD-VbUsV1l5IU2it4AaABAg,KALUSH,"і ви, тому що підтримуєте українське і проявляєте активність на каналі) підписалися?",2021-11-23T17:48:38Z,0
39,UgyfZ_W5nZXuLFeFzq14AaABAg,Ника,Так держать,2021-11-22T20:06:35Z,1
40,UgwEVXdK4ur7gEK-HfR4AaABAg,KALUSH,ви теж) були на нашому концерті?,2021-11-23T17:49:44Z,0
41,Ugw64Boj82fhVx0jRt94AaABAg,KALUSH,"хотіли б чути сумні, чи веселі?",2021-11-23T17:51:10Z,0
42,Ugwcp00rhQrNy4i201t4AaABAg,KALUSH,"круто, що прийшли б на концерт) постараємося приїхати) візьмете друзів з собою?",2021-11-22T14:30:51Z,1
43,Ugwq29vEoLGfvdbWw3R4AaABAg,Ukrainian,"Дуже))
Таку пісню гріх не вклучити на всю гучність",2021-11-22T20:59:32Z,2
44,Ugwq29vEoLGfvdbWw3R4AaABAg,KALUSH,дуже голосно слухаєте?),2021-11-22T14:31:40Z,2
45,UgyZJ0TD2f08eb-04u14AaABAg,KALUSH,дуже дякуємо) як вам альбом?,2021-11-22T14:33:07Z,0
46,UgwsXf7pSKtopLd8PVl4AaABAg,KALUSH,"дякуємо, якісь ще подобаються?",2021-11-23T17:52:47Z,0
47,Ugxv9Gfx90zGwf7nuX54AaABAg,KALUSH,то від вас така цифра тільки?),2021-11-22T14:34:24Z,0
48,Ugy5tqJunwiyFcLtvqB4AaABAg,KALUSH,маєте улюблений трек може?) вдячні),2021-11-18T17:46:52Z,0
49,UgzMLB2xzgaPPedVWYR4AaABAg,KALUSH,вдячні) хотіли б більше душевних треків?,2021-11-17T14:44:00Z,0
50,Ugx2SbsGzcfjAbiqqrx4AaABAg,KALUSH,подякували від всього серця),2021-11-17T14:44:38Z,1
51,Ugz5kgxA69wRtilLOg54AaABAg,KALUSH,дякуємо) з ким ще подобаються колаборації?,2021-11-17T14:47:05Z,0
52,UgztMMrcQ6pXBlTPEtx4AaABAg,KALUSH,"і такі класні слухачі, як ви!",2021-11-18T17:49:50Z,0
53,UgxiexsHz99KKqXx8-l4AaABAg,KALUSH,а як вам кліп?) подякували від щирого серця),2021-11-17T14:47:52Z,0
54,UgyXxwwcXf4LIdMRWc54AaABAg,KALUSH,аж почули власний голос на концертах),2021-11-16T16:30:24Z,0
55,UgwxkiC7Xbgm7YfUBv54AaABAg,KALUSH,вдячні!,2021-11-15T17:22:27Z,0
56,UgyUtluD3sidrShJlAd4AaABAg,KALUSH,ми вас теж чекатимемо),2021-11-15T17:22:56Z,1
57,UgwjzjR7dzHnSii-tg94AaABAg,KALUSH,"це перший трек, який почули? підписуйтеся, раді вас бачити з нами!",2021-11-15T17:23:45Z,0
58,Ugy-D6ADcF9HNcwlEu94AaABAg,KALUSH,тільки вперед!,2021-11-16T16:34:08Z,0
59,UgzAmtdh4yOnSFhK9TR4AaABAg,Владимир Яцентюк,"Чувак Калуш , этот тот кгюого в каждой совместке с Скофкой просто хочется вырезать и слушать только Скофку , это разные уровни ....это как сравнивать Басту и Сяву ...!!)",2022-02-18T21:18:03Z,0
60,UgzAmtdh4yOnSFhK9TR4AaABAg,Ярослав Тимофеев,@KALUSH знакомы с творчеством все,2022-01-06T19:03:04Z,4
61,UgzAmtdh4yOnSFhK9TR4AaABAg,KALUSH,"вам респект,що слухаєте! багато з ваших друзів знайомі з нашою творчістю?",2021-11-17T14:52:56Z,12
62,UgyDwxWjvxzkHagwvnp4AaABAg,KALUSH,вдячні від цілого серця),2021-11-10T13:13:54Z,0
63,UgxbE7XV1XugHSz2oYN4AaABAg,Лиса Алиса,@KALUSH авжеж😀,2021-11-11T15:18:56Z,0
64,UgxbE7XV1XugHSz2oYN4AaABAg,KALUSH,дуже приємно! чекаєте нових треків?,2021-11-11T15:05:58Z,0
65,UgwSDKo2SlPQyJLasEJ4AaABAg,Olena Pylypaka,"@KALUSH 
Якщо чесно, то ВСІ треки, записані із Скофкою вважаю шедеврами.
Хоча це ніби-то й не мій формат, бо я вже маю 55 років.😉",2021-11-09T15:23:15Z,0
66,UgwSDKo2SlPQyJLasEJ4AaABAg,KALUSH,"дякуємо, ще якісь треки зі Скофкою подобаються?",2021-11-09T15:13:59Z,0
67,Ugwjn4g0zrQVEB86J9Z4AaABAg,KALUSH,"вдячні, якісь слова вас зачепили?)",2021-11-09T15:14:21Z,0
68,UgwwrXdjhbyvHJsme-J4AaABAg,Bohdan,"@KALUSH Onuka, Wellboy, Go-A Подобається поєднання сучасної музики  та українських народних інструментів)",2021-11-18T22:22:12Z,0
69,UgwwrXdjhbyvHJsme-J4AaABAg,KALUSH,дуже приємно) когось ще з українських виконавців слухаєте?,2021-11-09T15:14:42Z,0
70,UgxT6iBXVwV4bIlpq9B4AaABAg,Andrey Stasyk,Бро я фанат тяжкого року … Але завдяки тобі я тепер знаю що таке реп який тягне мене в космос,2022-01-24T16:02:00Z,0
71,UgxT6iBXVwV4bIlpq9B4AaABAg,KALUSH,до нас взагалі не слухали?),2021-11-11T15:13:42Z,0
72,Ugw-jjoNL9P__CAnaWp4AaABAg,KALUSH,ці слова вас зачіпили?,2021-11-09T15:18:16Z,1
73,UgxBNFa0nGzPupZqXDh4AaABAg,KALUSH,подякували!,2021-11-09T15:21:06Z,0
74,Ugw1Mlgpjsg7fDul72l4AaABAg,KALUSH,приємно! ще якісь наші треки маєте у своєму плейлисті?,2021-11-10T13:19:54Z,0
75,UgzD1nPkKRK1VSkxF9F4AaABAg,KALUSH,вдячні! давно з нами?,2021-11-11T15:38:42Z,0
76,Ugz-AWIwtpcJlKJzc1F4AaABAg,Klevoye rukodeliye,Те саме і камін і мною зробили.,2022-02-02T08:56:17Z,0
77,UgxHSHpU-qqxw_vHNqN4AaABAg,KALUSH,"вдячні, що теж її використовуєте)",2021-10-28T17:02:49Z,1
78,Ugw27-QGKgA_wf4ky2F4AaABAg,KALUSH,вдячні від цілого серця! прослухали цілий альбом зі Скофкою?,2021-10-27T15:49:44Z,0
79,UgwZLL7wAuYC41Fn0FJ4AaABAg,KALUSH,вдячні! хочете на концерт?,2021-10-27T16:00:05Z,0
80,UgxNASxuOBprshj2nfR4AaABAg,Андрей Шохин,@KALUSH спробувати завжди можна),2021-10-27T04:55:21Z,0
81,UgxNASxuOBprshj2nfR4AaABAg,KALUSH,вже би могли зачитати?),2021-10-26T16:59:26Z,0
82,Ugwg4Uw2i3gsgA5Bs8t4AaABAg,KALUSH,"круто, що вам сподобалося і що повертаєтеся на канал знову і знову!",2021-10-26T16:59:52Z,1
83,UgyO5LSXEVPDTs6kngV4AaABAg,KALUSH,"дякуємо, що так активно коментуєте)",2021-10-26T17:00:39Z,0
84,Ugwb2q-8HBrU32x5h5F4AaABAg,Yevhen M,"@KALUSH  Друже можлиог трохи відверто, але Ми на Нічній Риболовлі коли горить вогонь, а Ми трохи розслабитися по чарці і папіросу на компанію. 
Під цю пісню без слів спілкуємося!!!",2021-10-30T17:02:17Z,0
85,Ugwb2q-8HBrU32x5h5F4AaABAg,KALUSH,дякуємо! додали в плейлист?,2021-10-26T17:01:43Z,1
86,UgwybObvJpuorbAf2EJ4AaABAg,KALUSH,"слухайте навіть тоді, коли не сумно) просто обирайте більш веселий трек)",2021-10-26T17:05:11Z,0
87,UgzKLm5eDZ0NJxUOlDl4AaABAg,KALUSH,"дуже дякуємо, приємно!",2021-10-25T17:22:22Z,0
88,Ugyjj_DwAKnvS6lH81N4AaABAg,Love Ukraine 💙💛,"@KALUSH файна, додому 🤞👌👌👌",2021-10-25T17:32:11Z,0
89,Ugyjj_DwAKnvS6lH81N4AaABAg,KALUSH,вдячні) які ще треки наші у вашому плейлисті?,2021-10-25T17:26:04Z,0
90,Ugx84akkn8lTEjhx8fF4AaABAg,KALUSH,приємно чути! були на нашому концерті?,2021-10-25T17:31:07Z,0
91,UgzDqvNlKDY1n-oeTHp4AaABAg,KALUSH,дякуємо!,2021-10-25T17:31:25Z,0
92,Ugz6oC9W7eFUAgXdW7Z4AaABAg,Natasza Sikon,"Sorry, помилка:
Scofka 😁",2021-10-26T17:38:09Z,0
93,Ugz6oC9W7eFUAgXdW7Z4AaABAg,Natasza Sikon,"Згодна з Тобою!
Ніколи не думала, що буду слухати реп.
І ось такі шедеври трапилися.
Браво Kalush i Sofka!",2021-10-26T17:28:04Z,0
94,UgycgYBznp2PlK0kmqV4AaABAg,Egor Maslowskiy,"@KALUSH дуже багато у вас крутих треків, назву тільки основні з них: не маринуй, зорі, будеш падати тіпок і в моєму списку улюблених ще багато))... 
Щойно малих (по 9 років) підвозив на тренування по тейквандо, і поставив їм тематичний трек ""будеш падати тіпок"". Позатихали і слухали уважно від першої до останньої ноти. І той малий що абсолютно російськомовний, виходячи з машини перепитував як правильно звучить приспів))). Вважаю це крутим ""Українським піддихом"" всякому моргенштерну",2021-10-22T15:22:32Z,0
95,UgycgYBznp2PlK0kmqV4AaABAg,KALUSH,круто таке чути! якісь треки ще подобаються?,2021-10-22T14:17:24Z,0
96,Ugzrv039VR9smQppk6F4AaABAg,KALUSH,хочеться ще слухати?),2021-10-22T14:22:13Z,0
97,Ugzas2XmyBlYC4iPA-p4AaABAg,KALUSH,"вдячні, передавайте усім друзям привіт! вони теж нас слухають?",2021-10-22T14:22:52Z,0
98,UgxaD0WXA2GPpXXgVAB4AaABAg,KALUSH,подякували від усього серця! чули весь альбом?,2021-10-22T14:23:30Z,0
99,UgyX0Ke8-qMBxzE0Hy14AaABAg,Vasil KD,"@KALUSH Не так давно тільки дізнався про вас. Тесть сказав жінці, жінка мені. Тепер кожен день слухаємо, а маллму 4 роки,  по кімнаті бігає танцює). Вже всі кліпи знає і коли починає грати музика то каже як пісня називається)
Круто. Тепер Російських артистів у даному жанрі слухати точно не буду, бо є ваші пісні, які набагато крутіше слухати на своїй мові",2021-10-21T18:55:17Z,0
100,UgyX0Ke8-qMBxzE0Hy14AaABAg,Vasil KD,"@KALUSH "" додому"", ""хвилі"", "" давай на чистоту"", ""Зорі"", ""Хвилі"" і багато інших)",2021-10-21T18:47:30Z,0
101,UgyX0Ke8-qMBxzE0Hy14AaABAg,KALUSH,"дякуємо, бачимо вашу похвалу під треками) який найбільше сподобався?",2021-10-21T15:11:56Z,0
102,UgwZnYnZvyCV3IuV8oZ4AaABAg,KALUSH,старатимемось! чекаєте нових треків?,2021-10-21T15:52:36Z,0
103,UgxSrb9WzSQlxHQ-VcF4AaABAg,KALUSH,вдячні!,2021-10-21T15:54:10Z,0
104,UgwkdoVYRVaQW4rfvoB4AaABAg,KALUSH,"вдячні і вам! круто, що ви з нами)",2021-10-20T15:09:07Z,0
105,UgyvvlT8fWcENaEWUwF4AaABAg,енот,"@KALUSH 
Звісно  , обов'язково.  Дякую вам , за суперовий україномовний реп   . Це круто , МОЛОДЦІ.  
 Підписалась на вас",2021-10-20T16:23:02Z,0
106,UgyvvlT8fWcENaEWUwF4AaABAg,KALUSH,дуже дякуємо! такі коментарі піднімають настрій) будете слухати ще?,2021-10-20T15:11:07Z,1
107,Ugxx15fiNTCi77xCddd4AaABAg,KALUSH,"вам респект, що слухаєте! а в музиці віку точно немає)",2021-10-20T15:12:55Z,1
108,UgyoOrOE9_LGh11NExl4AaABAg,Александр Емец,"P.S. треки многие нравятся, вы со Skofka. 👍",2021-10-20T18:09:23Z,0
109,UgyoOrOE9_LGh11NExl4AaABAg,Александр Емец,"Вам респект с Никополя! Желаю вам и дальше развивать ваше творчество! Очень много родного нашел в вашей музыке, словах, подаче всего вместе. Так шо хлопцы, от меня отдельный 👍респект и уважуха!",2021-10-20T18:04:33Z,0
110,UgyoOrOE9_LGh11NExl4AaABAg,KALUSH,подякували! ще якісь треки подобаються?,2021-10-20T15:13:11Z,1
111,Ugw1JXduN2DPmebaD6V4AaABAg,KALUSH,"круто мати таких сусідів, як ви! дякуємо за похвалу)",2021-10-20T15:13:35Z,0
112,UgxXLjMDLoC1RAu_KeN4AaABAg,KALUSH,вивчили вже слова? подякували),2021-10-19T15:27:56Z,0
113,UgydSY_cSaB2Pf2cXCV4AaABAg,Сергей Хрипченко,Обязательно,2021-10-19T18:00:38Z,0
114,UgydSY_cSaB2Pf2cXCV4AaABAg,KALUSH,дякуємо! будете на концерті?,2021-10-19T15:28:10Z,0
115,Ugwfmw2faHnnnWhJ6cN4AaABAg,KALUSH,"дуже приємно, що маємо таких юних слухачів) передавайте привіт!",2021-10-19T15:29:51Z,1
116,Ugw6zMYr686tpuqW6xB4AaABAg,vigor квм,"Тільки взнав що ще мінус 1 в мене ............,",2021-10-15T21:39:54Z,0
117,Ugw6zMYr686tpuqW6xB4AaABAg,vigor квм,Так і я брат,2021-10-15T21:37:15Z,0
118,Ugxv-Ss8GIVB5RC8LWJ4AaABAg,KALUSH,"Дякуємо, а ми раді, що вам подобається)",2021-09-30T14:33:24Z,0
119,Ugy9vwRFz687OkCMjGl4AaABAg,Катя Мазур,"@KALUSH так склалися обставини(
 але не засмучуємося наперед, впевнена, що ще побуваю❤♡
Ваша творчість це щось неймовірне, нечасто таке зустрінеш, особливо українською.
Продовжуйте в тому ж дусі (=",2021-09-30T18:17:33Z,0
120,Ugy9vwRFz687OkCMjGl4AaABAg,KALUSH,чому?( ми на вас чекали,2021-09-30T14:52:28Z,0
121,Ugwbcr2iOH6mSRqjLgh4AaABAg,KALUSH,"дякуємо за підтримку, чули усі спільні треки зі Скофою?",2021-09-30T15:07:26Z,0
122,UgxqsOXwEItcUkyOgLd4AaABAg,KALUSH,"круто, що слухаєте! дякуємо за це)",2021-09-30T15:23:37Z,0
123,UgwVpJcCsYkTCRvkRgN4AaABAg,Ярослава Лукинюк,"@KALUSH Почула Ваш трек на каналі Олександра Беспалого і знайшла окремо. Ще сподобався ""Додому"". Творчих успіхів !",2021-09-28T15:27:33Z,0
124,UgwVpJcCsYkTCRvkRgN4AaABAg,KALUSH,дякуємо! якісь ще подобаються треки?,2021-09-28T14:30:43Z,0
125,UgzZ2bJAED3RA88InlF4AaABAg,KALUSH,"вдячні за підписку! залишайте коменти під треками, які сподобалися:)",2021-09-28T14:24:39Z,0
126,UgzVRkW4MqGR38xlKt54AaABAg,KALUSH,"круто, що ми розбили стереотип) хотіли би з кимось трек?",2021-09-28T14:37:01Z,1
127,Ugy5xbniGYn9pPsMFVd4AaABAg,KALUSH,вдячні!,2021-09-28T14:37:34Z,0
128,UgwMX-a_3VrqIQxXsSR4AaABAg,Tik Tak,"@KALUSH на жаль, ще не був, але з нетерпінням чекаю на зустріч) ви - супер!",2021-09-27T13:40:07Z,0
129,UgwMX-a_3VrqIQxXsSR4AaABAg,KALUSH,"дякуємо, що підписалися і залишили такий крутий коментар! були на нашому концерті?",2021-09-27T13:31:41Z,1
130,UgzsDAw0jcI2CMkvdQF4AaABAg,Виталий Нестеренко,"@KALUSH ""додому""взагалі хітяра.але сьогодні на повторі давай начистоту прослухали ми разів 50.це взагалі шедевр",2021-09-27T18:10:14Z,0
131,UgzsDAw0jcI2CMkvdQF4AaABAg,KALUSH,вдячні! що ще подобається з нашої творчості?,2021-09-27T13:32:44Z,1
132,UgwQzSfR_iEVic6bLgJ4AaABAg,KALUSH,дякуємо! будемо старатися для вас),2021-09-27T13:33:50Z,0
133,UgzbqTzwPPi769t-goR4AaABAg,KALUSH,обняли!,2021-09-27T13:35:04Z,0
134,Ugx7-_Tkuhaw3t_6_Ep4AaABAg,Максим,@KALUSH так),2021-09-28T07:27:12Z,0
135,Ugx7-_Tkuhaw3t_6_Ep4AaABAg,KALUSH,дякуємо! ще якісь спільні зі Скофою слухали?,2021-09-27T13:38:34Z,1
136,Ugw7Q3E2-hZAmsJovb14AaABAg,KALUSH,і вам дякуємо!,2021-09-21T16:17:38Z,1
137,UgyBzYr4ME4UdIOVKT14AaABAg,KALUSH,круто! передавайте малим привіт),2021-09-21T16:18:19Z,0
138,Ugzi_uIwHlg7st1egwd4AaABAg,Olga,"@KALUSH Звісно, і не одного 🥰улюблені треки: «давай начистоту», «файна», «додому», «таксі». Ваші пісні лунають з вікон квартир і машин в Нью-Йорку 🇺🇸 Чекаємо вашого туру) ❤️",2021-10-03T00:42:52Z,0
139,Ugzi_uIwHlg7st1egwd4AaABAg,Yevhen K,"пфф ... на рингтоні, мелодія особливо зачепила 😀 Мене не питали, але у фаворитах ""Додому"" та ""Давай на чистоту"", трохи менше ""Таксі"" з Христиною. Взагалі колаби чудові, молодці!",2021-09-23T17:12:08Z,1
140,Ugzi_uIwHlg7st1egwd4AaABAg,KALUSH,дякуємо вам за це) маєте фаворита серед треків?,2021-09-21T16:18:35Z,1
141,UgzD9hijoflP0OZCyVt4AaABAg,KALUSH,"вам дякуємо за приємності в коментарях) підписуйтеся, в нас цікаво)",2021-09-17T12:36:26Z,1
142,UgyQrcdD5VkJWmbzwM54AaABAg,Андрей Демидович,@KALUSH чекаю від тебе нової ще шедевральнішої творчості.,2021-09-14T16:30:05Z,0
143,UgyQrcdD5VkJWmbzwM54AaABAg,KALUSH,"приємно, що ви придивилися до цього жанру) дякуємо, що вам сподобалася саме наша музика!",2021-09-14T16:23:39Z,1
144,UgxVcyUo93-ReCS1eOB4AaABAg,KALUSH,"може, час приєднуватися?) ми тримаємо кулаки, щоб вам почав більше подобатися реп)",2021-09-14T16:48:02Z,0
145,UgxtpszS06jdxDENoM54AaABAg,KALUSH,дякуємо!,2021-09-08T09:20:26Z,0
146,UgwSIYl8nvmolrXQZh14AaABAg,KALUSH,"а вам дякую, що це підтримуєте) повірте, не меншого варте)",2021-09-08T09:22:07Z,6
147,UgwakPHsnkhz3lY4fFl4AaABAg,KALUSH,"Якщо почали в нас на каналі - то надприємно) в нас тур Україною, прийдете на концерт?)",2021-09-08T09:22:39Z,0
148,UgyoY8-ida7-lrfngIF4AaABAg,STEFANO,Всі ми використовуємо деякі російські слова.,2021-09-09T07:03:12Z,0
149,UgzXmbxwQoRFCAjH1vl4AaABAg,Василий Середний,@KALUSH ще і не сам прийду!!!!,2021-09-03T19:32:25Z,0
150,UgzXmbxwQoRFCAjH1vl4AaABAg,KALUSH,"круто, що качає) прийдете на наш концерт?)",2021-09-02T12:24:59Z,0
151,UgxeS0uXqYIHxrfCEBp4AaABAg,Юра Старцун,"Реклама і пропаганда працює, тому і слухають моргенштернів. Я від початку війни, взагалі не слухаю пісні які російською мовою",2021-12-07T17:12:37Z,1
152,UgxeS0uXqYIHxrfCEBp4AaABAg,ELSATANA,Морген нормальный и не глупый чувак.,2021-11-27T18:19:45Z,0
153,UgxeS0uXqYIHxrfCEBp4AaABAg,KALUSH,"кожному своє, а за слова в підтримку подякували. мед на вуха)",2021-09-02T12:27:19Z,2
154,UgxSQqgM0ru0vlg_WGB4AaABAg,KALUSH,подякували від щирого серця),2021-09-02T12:39:25Z,0
155,UgwQLGUfreJRoNdYGD14AaABAg,STALKER DobriY,"@KALUSH можем скооперироваться, свожу вас в зону отчуждения, снимите новый клип 😏☢️",2021-09-02T12:44:12Z,0
156,UgwQLGUfreJRoNdYGD14AaABAg,STALKER DobriY,@KALUSH нет) около месяца),2021-09-02T12:42:47Z,0
