,id,comment,author,likecount,publishedAt
1065,Ugyr-r2J0eoXbUD3noh4AaABAg,"Випадково Вас почув в одному кафе, і тепер разом із дітьми вчимо слова ваших хітів 😎дуже гарно, файно лягає 🎼🎷",Николай Громов,156,2021-08-06T20:58:13Z
1066,Ugw_Uq7BsAqqUth5BSx4AaABAg,Дякую за творчість❤️,Ольга Грицай,0,2021-08-06T20:45:53Z
1067,UgxFli5pc96mjbT2exp4AaABAg,Бомба)),Олександр Бовсуновський,1,2021-08-06T20:22:49Z
1068,Ugx02ttAR_HVmMfYXzh4AaABAg,БОМБА!!!,Оксана Герштун,1,2021-08-06T19:56:05Z
1069,UgwWCVjx69AVMAxlG7h4AaABAg,Я весь день слухаю цю пісню. Це нєчто!!! Почула вмпадково на айтюнс! Супер. Така життєва і крута. Не відірватись!,Оксана Герштун,1,2021-08-06T19:55:54Z
1070,Ugz5nrYxVANGxr1tfeV4AaABAg,"Тільки що з Файного, Ви мене порвали) став трохи репером.",Zui Zui,1,2021-08-06T19:50:24Z
1071,UgzuxhueKEYkMFF7nBZ4AaABAg,"Крім крутої музики і відео тут ще й реально життєва історія. Гадаю, що багато хто тут почув про себе і друзів теперішніх... і, нажаль, колишніх((.",hizhym,1,2021-08-06T18:33:56Z
1072,UgwcmT-yOBNSRsE97wJ4AaABAg,"Красава, ну Мы же тоже могем!",Санек санечек,1,2021-08-06T17:59:24Z
1073,Ugz9WGvVEcPuk11z-ox4AaABAg,"В мого чоловіка загинув кращий друг в АТО, слухаючи цю пісню він завжди мовчить, і плаче, ну не показує цього, душа болить, те, що не поспілкувався з ним, багато чого не сказав йому. Дякую Вам за правдиві слова!!! Ви молодці!!!!",Антонина Иванова,31,2021-08-06T16:28:02Z
1074,UgzzF2rQXPYm-VUMnel4AaABAg,"хотите на чистоту?  Раньше перся от В.У.З.В.  ,Т.Н.М.К. , а сейчас  вот слушаю Алёну и Kalush,вот песни такие же крутые ,но вот шо то не то,а не то шо насаждают мову ,и это начинает вызывать отвращение ,нутром розумiю,шо наши,а в душе из за примусового навязывания мовы , отвергаю,А так Вы ребята молодцы!!! Донбасс вас слушает но сердце от навязывания отвергает,хотя ну вот супер Хотя бы песня Гори,Типок, но на подсознании...",гусь хрустальный,1,2021-08-06T14:52:20Z
1075,UgyeuMS7Wn7VCDmicXJ4AaABAg,Трек - 🔥 👍 💙💛 🇺🇦,Надія Волошина,2,2021-08-06T13:40:56Z
1076,UgwizJNl3g580yYfJyB4AaABAg,wow it is really amazing,Zany,0,2021-08-05T23:45:45Z
1077,UgwHaWEsQdyWlbH0STt4AaABAg,Найкраща група. Гордий тим що живу в місті де народжуються такі таланти,Назар Пристай,1,2021-08-05T23:44:27Z
1078,Ugy6QJMePxZO58eVCAF4AaABAg,Гарна пісня хто за лайк,Юля і Манюня ,1,2021-08-05T22:21:48Z
1079,UgxHmiliYVGXFoImAnt4AaABAg,Хлопці ви супер. Так душевно. Ви видкриття номер один для мене цього року. Це те чого не вистачало так укр музиці.,Andriy Rudas,1,2021-08-05T21:06:28Z
1080,UgztyGoogLFR9SuQ1Ap4AaABAg,👍,Igor Sim,0,2021-08-05T19:46:29Z
1081,Ugy_7muPw1AlVy1WIbB4AaABAg,Дякую,igor yar,0,2021-08-05T15:04:42Z
1082,UgxhKz26p5iCJQ8oHuh4AaABAg,"Хлопці, це справжнє відкриття для мене у жанрі реп.
Не хочеться вас порівнювати ні з ким, проте порівняння з ""руським рєпом"" не минуче.
І це просто НЕБО і ЗЕМЛЯ:
глибокі слова, які проникають у самісіньке серце
без матючча, а якщо і буде - то дуже вдало і в тєму
0 пафоса і виєбонів
Від душі - молодці! Про вас має знати вся країна.",Oleksii Kutsenko,0,2021-08-05T08:18:48Z
1083,Ugyx25loZLYhDaNQcE94AaABAg,сильно !!!!!!!!!!!!!!!!!!!!!!!!!!!!!!!!!!!!!!!!!!!!!!!!!!!!!!!!!!!!!!!!!!!!!!!!!!!,Andriy Melnyk,3,2021-08-04T21:36:04Z
1084,UgxIQVC8L-dtu8Oz3QZ4AaABAg,"Заехала с первого раза)))крутая тема,бомба💣💣💣🖖🖖👍👍👍",Иван Никулин,8,2021-08-04T20:07:40Z
1085,UgzEMLwGc6pLtzYYE-d4AaABAg,🤝🤝🤝🤝🤝🤝🤝🤝 Nice 👌👌👌👌,Orbites Orbites,0,2021-08-04T18:48:22Z
1086,UgwWAIB9UPL-td5gA0p4AaABAg,....браво українці,lgor Kulish,0,2021-08-04T17:04:55Z
1087,Ugz5QzqOigRuVZ0pLyR4AaABAg,"Дуже круто)!!!  тільки почув зразу мурахи під шкірою ожили) як на мене крутіше ніж альонка, хоча до цього думав,  що вона найкрутіша репачка серед українців. Так тримати! я горжусь тим, що живу з вами в одній країні і розмовляю однією мовою",Zachar Lew,2,2021-08-04T16:39:13Z
1088,Ugxqb-wtic8uapPxK2B4AaABAg,"Брат, Ходорів з тобою 😘😘😘",Наталія Василюк,0,2021-08-04T16:26:57Z
1089,UgxIczTAK2g9p_FR9bR4AaABAg,хIт!!!! 1000%%%,EVGEN VL,0,2021-08-04T15:04:39Z
1090,Ugza74wB1yj_D4zir1B4AaABAg,"Слухаємо всією сім""єю !)",Ирина Савоник,1,2021-08-04T06:32:12Z
1091,UgxJYl6NqW8e6RefaHV4AaABAg,Вас почув на хвилі радіо.. Відразу зачепило та звук на всі 100... Так тримати..,Михаил Йовенко,1,2021-08-03T20:49:38Z
1092,Ugy8WX3WlO0dcTwSilZ4AaABAg,Розмова на «чистоту» з нами….,Viktor Kabatsii,0,2021-08-03T20:20:15Z
1093,Ugypub5B1jJhd2sOBgl4AaABAg,Чисто? Український контент!,Олексій Смирнов,0,2021-08-03T19:45:25Z
1094,Ugx1iuqktES7Yb0ZN7Z4AaABAg,"Брате,від ЗСУ-респект!!!!",Олег Кашернюк,0,2021-08-03T19:44:34Z
1095,Ugz5CgOYPDVMzFlKeHB4AaABAg,+,Eugene Gennadievich,0,2021-08-03T16:35:06Z
1096,UgwJ4sFje4ndElXKe2p4AaABAg,старий металіст але ваш реп качає!),Руслан Я,0,2021-08-03T09:29:40Z
1097,Ugy8QethXktQA7d3MWl4AaABAg,"Дуже глибокі тексти і музика,як для таких молодих хлопців.",Володимир Дороги,5,2021-08-03T08:54:37Z
1098,UgzHpnVVHA_wd7XysMF4AaABAg,"Я не фонат рэпа ,ну это супер .Тупо нет слов",Дима Догокер,1,2021-08-03T08:25:02Z
1099,Ugzq1wmpRZxr7HSDu-Z4AaABAg,Maybe someone can translate about what this song?,Ro Bis,0,2021-08-03T06:14:09Z
1100,UgzQuMy4EUFUNXD4TS94AaABAg,"Мій край!!!
Київське море",Ut Taxi,1,2021-08-02T23:15:52Z
1101,UgzXX9W4DYz6MMVspZ14AaABAg,"Пісня - чистий кайф, кожний раз насолоджуюсь при прослуховуванні.",Nastya Nastya,7,2021-08-02T22:22:43Z
1102,UgyIXizM-Fakj-ZOG7d4AaABAg,"Дякую за українську, дякую що діти виростуть гідними людьми від ваших пісень",Alina Panasyk,1,2021-08-02T21:09:32Z
1103,UgyxEmrFj7vZX97R0yp4AaABAg,огнонь  без б!!!,EVGEN VL,0,2021-08-02T17:39:59Z
1104,UgwK_kysw6S160WgTTp4AaABAg,"Давай на чистоту, сядем разом на мосту
І побазарим зараз тут хай старі рани заростуть
Давай на чистоту, сядем разом на мосту
І побазарим зараз тут хай старі рани заростуть",Olexandr Demch,2,2021-08-02T17:18:52Z
1105,Ugz_HbmvyMFT7HERBFp4AaABAg,"Супер! Творите, мужчины!",MrShurikovskiy,1,2021-08-02T16:11:38Z
1106,UgwulBI3NybUxn5ZLOt4AaABAg,"В чора був десь, біля тебе грузився   ламінатом!",sw1mer,0,2021-08-02T14:22:21Z
1107,UgwGrVOBzHrYziT3Bx94AaABAg,Супер☺,DarlingUA,1,2021-08-02T14:17:19Z
1108,Ugz-WgDekG1VB4geDz54AaABAg,"Це ще один з етапів Українізації, велике діло робите, хлопаки!!!",Denis Grytsenko,302,2021-08-02T13:34:35Z
1109,UgwiZ8B-jrMjegpf9wl4AaABAg,Вся бригада Сарни Рем балдіє)))),Тарас Корзюк,0,2021-08-01T22:24:03Z
1110,UgyCYVPVPgGCLRk3AUB4AaABAg,Круто,Тарас Корзюк,1,2021-08-01T22:23:29Z
1111,UgzYjofzIPjf1zRRhBN4AaABAg,Дякую за пісні українською !,Aleks Soul,2,2021-08-01T21:09:54Z
1112,UgyvJokqiyeCrsQd0JJ4AaABAg,"крутяк,супер це просто щось!!!!",Павло Сорочинський,8,2021-08-01T21:00:40Z
1113,UgxpzklSSJt8ZGnDN6F4AaABAg,"Пацани, робіть титри в ютубі на Інгліш!
Мадонна буде курити в сторонці!
Браво! 👏",GP,2,2021-08-01T19:50:30Z
1114,UgwcOAP24SAFqIPth0B4AaABAg,Топ,Назар Бандера,0,2021-08-01T19:49:22Z
1115,Ugx4K6HzZ3UhHVVsf0Z4AaABAg,"Ну я как и все, комент лайк, пацаны просто красавцы",Чак Норрис,1,2021-08-01T19:34:07Z
1116,UgxNOh9Yk4yQhmsQGvl4AaABAg,Калуш смени цвет кепочки)))дякую,Вова Березовский,0,2021-08-01T19:02:46Z
1117,UgwEedfCT9cc8cMq7IZ4AaABAg,Зачёт репчик.,Олег Руденко,0,2021-08-01T18:17:46Z
1118,UgwGnkivPjc6_qBJW6t4AaABAg,Кому подобається цей хіт став ЛАЙК.,GNOTIO FOOD,1,2021-08-01T17:14:55Z
1119,UgzoTSjGjE1-pb8hIL14AaABAg,Так тримати.... ми є УКРАЇНЦІ,Oleksandr Velychko,2,2021-08-01T17:01:48Z
1120,UgzGCrBkBFUslLgufYV4AaABAg,"Калуш ви краща тру група заходу , завжди підтримаю вашу творчість !",Ivano Frankivsk,25,2021-08-01T16:48:02Z
1121,Ugw_YnTVwhoIBhmYBCN4AaABAg,Щось!!!!!!¡,BimbeR UA,0,2021-08-01T15:42:25Z
1122,UgxAonGP-EBYZfq30xN4AaABAg,"Улюблена ❤️
Хлопці- молодці 👌🏻🥰",Lena Lena,2,2021-08-01T15:30:11Z
1123,Ugzo0najBf8q9oiKThB4AaABAg,"Господи  

Я слухаю і плачу .... саме таких друзів майже нема...",__Lovely Minako,4,2021-08-01T13:01:43Z
1124,Ugxdmm7tTyEurqs5iHB4AaABAg,Кайф 🔥🔥🔥,Вова Малина,0,2021-08-01T09:12:21Z
1125,UgyaYhr8AluYxwyN76F4AaABAg,"Після ВУЗВ Най, най, най просто охuЕNNNooo, більше, більше, більше!!!!!",Ut Taxi,0,2021-08-01T08:46:42Z
1126,Ugwer1Ihj6DoSyg0ZhN4AaABAg,"Дуже гарна пісня, молодці хлопці!!!",Вадик Носков,4,2021-08-01T06:25:10Z
1127,Ugy83-pL6EtAHoHTw1d4AaABAg,"Своя тематика, свій стиль читання - все круто.
До речі, титри допомагають зрозуміти, що читає KALUSH.",Йосип Ковач,2,2021-08-01T06:08:04Z
1128,Ugw3Fi_WQJTzl6pJJDB4AaABAg,"Шикарно
Просто інших слів немає...",Юрій Петрук,0,2021-07-31T21:47:35Z
1129,UgymSYpa5bZAn6ohyoJ4AaABAg,Гарно.,Володимир Кондратенко,0,2021-07-31T20:31:23Z
1130,Ugzk8OViz3myfg-VkaF4AaABAg,"Молодці, хлопці класний реп✨✨💫",Ярина Пазин,0,2021-07-31T19:01:15Z
1131,UgxUqSQA6G2SDHgyXI94AaABAg,"Пацики так тримати👍👍👍
Продовжуйте працювати в тому ж напрямку ⚠️⚠️⚠️",Дуже Цікавий,0,2021-07-31T18:39:52Z
1132,UgzZBrLw01h89EQQEzF4AaABAg,"Текст:
Давай на чистоту, сядем разом на мосту
І побазарим зараз тут хай старі рани заростуть
Давай на чистоту, сядем разом на мосту
І побазарим зараз тут хай старі рани заростуть
Розкажи друг, шо не так, де пропадаєш так давно?
Може я провтикав літак, а ти літаєш наді мною
Куди звонить? Дай цифри по яким ти в зоні доступу
Ми сядем в тачку, газ до поліка, в полi (пупупу) в пустоту
Давай забудемо обіди братан, напишем на паперi, викiнем за паркан
Будем думать шо це був невдалий
пранк, залетим в клуб і сядем за один танк
Друже, я за тобой скучав, давай намутим голку і надуем м'яча,
А помниш той чат? Під вікном кричать! Як на чувачі ми ділили дівчат
Давай на чистоту, сядем разом на мосту
І побазарим зараз тут хай старі рани заростуть
Давай на чистоту, сядем разом на мосту
І побазарим зараз тут хай старі рани заростуть
Ми самі обманули, ми самі до сивини
Розумієм нононононо правда колить
Ми самі обманули, ми самі до сивини
Розумієм нононононо правда колить
Біля мене кругом були,
ніби брудні вікна і тупік, там всі дома склонилися на бік
Після пари промахів, вже недовіра вічна, мені звично тільки віч-на-віч
Я повторю знову тобі: Будь тру, бо так тупо всі потуги в ступор завели
Панти тебе. Це фейковий рупор, дружбі — це штопор, затуп
Я не в пантах, от не дивина — не попав в пастку
Просто я думок людей
Знооооооов
Я не в пантах, от не дивина — не попав в пастку
Просто я думок людей
Знооооооов
Давай на чистоту, сядем разом на мосту
І побазарим зараз тут хай старі рани заростуть
Давай на чистоту, сядем разом на мосту
І побазарим зараз тут хай старі рани заростуть",1 1_Sub1_Zero0,18,2021-07-31T15:41:10Z
1133,UgySbpYWn6mv82T4vkd4AaABAg,А я Луганчанин і мені все це подобається ви круті! Наша мова одна із топових!!! Все що ви робите це топ!,floodast,147,2021-07-31T14:35:28Z
1134,UgwSlpfRzrnrCfaIp7N4AaABAg,На клип ума нету(((,Ukraine News,0,2021-07-31T13:00:25Z
1135,UgwadS0NAOZycaFwhPZ4AaABAg,Щось мало підписників підпишіться хто не підписався,dima dasov,1,2021-07-31T12:29:38Z
1136,UgzuYLjB7dbnjb6A--94AaABAg,Калуш вже не торт,Serhii Kushnir,0,2021-07-31T06:59:52Z
1137,UgypNh0froUq89HO5uR4AaABAg,"Супер! Цікаво шо за місцевість де знімали кліп, хто знає?",Олег Мирошниченко,0,2021-07-31T06:58:36Z
1138,UgyppKAPLyAaHhxazSR4AaABAg,Круто,Cергей Вавулин,0,2021-07-31T04:24:15Z
1139,Ugx5DaFVQCcOMN3VeUF4AaABAg,Музикка топ,ПАВЕЛ,0,2021-07-30T23:49:47Z
1140,UgxaC-lEDvMLqhJlyO94AaABAg,Текст)?,Віктор Мателега,0,2021-07-30T22:39:42Z
1141,Ugy19w6o9_kGrm6erIF4AaABAg,Я один переживав щоб ковьор не загорівся?),Виталий Б.,1,2021-07-30T20:48:41Z
1142,Ugy5dlAqiffXyXZl7oZ4AaABAg,БОМБАЯД,the_fooding,0,2021-07-30T19:51:06Z
1143,Ugy-26cb2eH6PICT9px4AaABAg,"В Росії,. 'певец года' моргенен- давай Калуш народного, культура мови",Вадим Голую,1,2021-07-30T18:24:03Z
1144,UgxNInklIM_DK6kaEu14AaABAg,Ідеальний дует,Дарья Макушенко,1,2021-07-30T15:50:35Z
1145,Ugz_wRXAX__jG1h9RZB4AaABAg,Klasssss!! дуже сильно!,Just Mk,0,2021-07-30T14:19:31Z
1146,Ugztiv893YJ8_SwFQrZ4AaABAg,"Ох, слухаю на паўторы ўжо другі дзень, і ёсьць адчуваньне, што гэты трэк мяне яшчэ доўга не адпусьціць. Дзякую за шчырасьць і глыбіню. Таксама не рэп фанатка,  але ваша музыка павяртае мяне дамоў, на Беларусь, кранае самае балючае - вырваныя карані. Плачу, а не магу спыніцца слухаць. Вялікі дзякуй, дарагія ўкраінцы ❤",Julie Zolà,487,2021-07-30T12:57:25Z
1147,UgxpcD-R_xXbw9oz4pt4AaABAg,"супер! Ребята Вы большие молодцы, уже как год за вами слежу! Вы просто космос!",Егор Василихин,3,2021-07-30T10:47:16Z
1148,Ugy_Y6AjbZjiSstlp6t4AaABAg,Поверніть попереднього  співучого Килима будь ласка 😔 трек супер👍 Чи це Скоф був раніше Килименом?,Dimur Bichik,0,2021-07-30T05:00:21Z
1149,Ugwvn0VVMSbej40S9Fl4AaABAg,"це хiт!але слабенький,ну хiт))))",Саша Просяник,0,2021-07-30T04:49:08Z
1150,Ugzoi3XlWhimcJrGtid4AaABAg,Чотко👍👍👍,Petro Vasylytsia,0,2021-07-30T04:18:09Z
1151,Ugwto6zVLOakkjHxaJt4AaABAg,"Знаходжуся за кордоном, але слухаючи ваші пісні почуваю себе дома.
Дякую вам за таку музику, удачі вам✊",Олексій Лащ,3,2021-07-29T20:54:17Z
1152,Ugyqj2vmcMzKoH2nWTh4AaABAg,Круть! Нарешті КРУТИЙ  Український РЕПАЧОК!,Makoviy Andriy,0,2021-07-29T20:07:56Z
1153,UgyldGwweI6eiIwuPXR4AaABAg,Так тримати 💪💪👍👍🔥🔥🔥Клас,Анатолій Киричук,0,2021-07-29T19:50:45Z
1154,Ugx4kEPjDAlkzlGE2EF4AaABAg,"Круто, так тримати)",Олександр Осауленко,0,2021-07-29T16:31:24Z
1155,UgyEPwxz8sWv8Q79TQV4AaABAg,Сильно 😔😔😔,Lecsus,0,2021-07-29T14:37:55Z
1156,Ugy4dS5vzQ1LF_I3mj54AaABAg,👏👏👏,нуб донатир,0,2021-07-29T13:45:57Z
1157,UgyU_2uAv1QRvVM4OBZ4AaABAg,"Дякую хлопці, завдяки вашій пісні    згадав молоді роки ...як на чувачі ділили дівчат)) супер 👍 Рівне з вами !!! Рвіть інтернет Ви того варті 🇺🇦",Kolya Bak,0,2021-07-29T11:20:56Z
1158,UgwFmi8Ce4mB6v-meup4AaABAg,"Хлопці, ви неймовірні молодці!!! Ви реально творите нову музику, розбиваєте стереотипи, що реп не звучить українською. Я й завдяки вам починаю любити реп, точніше тільки ваш реп поки слухаю. Дякую вам за українську музику, продовжуйте творити!!! Це мощ!",Khrystyna Khoma,6,2021-07-29T09:54:11Z
1159,UgxjhlltpFbuU3O_efF4AaABAg,Супер❤️👍💯,Marina Staroviretz,1,2021-07-29T08:29:45Z
1160,Ugy6hFtkBXDCIP2qnKd4AaABAg,Супер,Микола Лещенко,1,2021-07-29T05:05:27Z
1161,UgzssT7Q4gPKefbXtHt4AaABAg,Вподобайка 👍🇺🇦,Діма Приходько,2,2021-07-29T03:27:11Z
1162,Ugx0A9IhKgUq9jxb-qd4AaABAg,"Красавці , трек 10 з 10!!!!",Angry Ukrops,1,2021-07-29T01:27:50Z
1163,UgysMELLW2JZg8POfOp4AaABAg,Дякую хлопці за круту музику,Дмитро Опрелянський,0,2021-07-28T22:14:44Z
1164,UgyhvyNboLl29n9dL-p4AaABAg,"В мене малий розгледів ззаду поліцаїв)))) Блін, бігме не бачив)))) А вони реально позаду їхали???
 Він вас обожнює!!!! Скофа вже читає (бубонить, але внятно ) А от Калуша через раз, ))))  Губиться від швидкості))))",Максим Фурман,1,2021-07-28T20:43:45Z
1165,UgySrji8PrweRu71LAd4AaABAg,"Спасибі вам, хлопці!😍 Не очікувала від себе, що сподобається цей жанр)))",Віта Залюбовська,0,2021-07-28T19:13:21Z
1166,UgywyZ43zl-EY8aLcdx4AaABAg,Сила....пацани красавчики😎😎😎,Nikolas Mikolas,1,2021-07-28T18:53:33Z
1167,Ugwkex5FWBPeb3DDwzx4AaABAg,БОМБА МОЛОДЦІ ТАК ТРИМАТИ,Сима,0,2021-07-28T18:48:37Z
1168,UgyNKrTofXDEOMGO8154AaABAg,"Складається враження що Псюк захопився хоку. Набір слів під свій флоу, Скофка витягує всі треки спільні!",Roman Prytula,0,2021-07-28T18:29:59Z
1169,UgzGmdE90bo9p6kCXQN4AaABAg,То є файно!!!,Oleks,0,2021-07-28T17:44:06Z
1170,Ugx3YOlSGdiEjR1ErA54AaABAg,"Чисто, без бруду, просто про життя!!! Обожнюю вас!",Олена Кліщ,3,2021-07-28T14:36:12Z
1171,Ugz_gtlzh85eZwz-uB54AaABAg,ЛАЙКОСИК!,Илон Маск,0,2021-07-28T10:09:38Z
1172,UgwOWiaS_PqSi1gIIF94AaABAg,Супер !!!,F.I.X,0,2021-07-28T06:53:16Z
1173,Ugzu1WIJH5XF7KjA1vN4AaABAg,KALUSH- це реп який впав в плодовиту українську землю,Oleg Lesyuk,0,2021-07-28T05:51:27Z
1174,UgxbtlC8TIKB_2mzQep4AaABAg,парни вы Красавчики ))),Сашка,0,2021-07-27T19:40:56Z
1175,Ugz2vkLFnjiofBA6z794AaABAg,"Зйомки кліпу на Києвському морі😍
Там класно, постійно там буваю😍✌️",Саша сендер,0,2021-07-27T19:36:29Z
1176,UgxsA7YMoaatGZINOQJ4AaABAg,Круто що з'являється нова українська музика топ рівня,Roman A,0,2021-07-27T18:03:16Z
1177,Ugz34XbaUUyk3JKHiBR4AaABAg,"В свое время ТНМК и Грин Грей так же взорвали. Парни, вы супер.",Константин Григорук,0,2021-07-27T16:12:03Z
1178,UgyMKuz4mh8CxgCPcgd4AaABAg,Обожнюю цю пісню,Євгенія Дем'янець,0,2021-07-27T15:39:12Z
1179,UgxNqzuVgf2-rvC64N54AaABAg,"Не пойму, припев на белорусском ?",Юша Коrни,0,2021-07-27T12:00:07Z
1180,UgxHc4MMt0c48L-Rlb54AaABAg,"""Додому"" до сліз, дякую",Ирина Чернова,1,2021-07-27T08:59:44Z
1181,Ugw9mw06Kyf1Eyu6lj94AaABAg,"Давай на чистоту, сядем разом на мосту
I побазарим зараз тут хай cтaрi рани заростуть
Давай на чистоту, сядем разом на мосту
I побазарим зараз тут хай cтapi рани заростуть


Розкажи друг шо не так, де пропадает так давно
Може я провтикав лiтак, а ти лiтаеш надiмною
Куди звонить? Дай цифри по яким ти в зонi доступу
Ми сядем в тачку, газ до полiка, в полi ( пу пу п у) в пустоту

Давай забудемо обiди братан, напишем на папeрi викiнем за паркан
Будем думать шо це був невдалий пранк, залетим в клуб I сядем за один танк
Друже я за тобой скучав, давай намутим голку I надуем м'яча
А помниш той чат? Пiд вiкном кричать! Як на чувачi ми дiлили дiвчат

Давай на чистоту, сядем разом на мосту
I побазарим зараз тут хай cтaрi рани заростуть

Давай на чистоту, сядем разом на мосту
I побазарим зараз тут хай cтapi рани заростуть

Ми caмi обманули, ми caмi до сивини
Розумiем нононононо правда колить

Бiля мене кругом були нiби бруднi вiкна I Тyпiк там вci дома склонилися на бiк
Пiсля пари npoмахie вже недовiра вiчнa менi звично тильки вiч на вiч
Я повторю знову тобi будь тру бо так тупо вci потуги в ступор завели
Панти тебе це фейковий рупор, дружбi це штопор затуп

Я не в пантах, от не дивина не попааав в пастку просто я людей думок
Знооооооов
Давай на чистоту, сядем разом на мосту
I побазарим зараз тут хай cтaрi рани заростуть
Давай на чистоту, сядем разом на мосту
I побазарим зараз тут хай cтapi рани заростуть..",ᎮRoKħoŽhIγ,1,2021-07-27T08:33:53Z
1182,UgxAQJewstofFw2y_pd4AaABAg,🤘,svetlana lutviakova,0,2021-07-27T08:09:59Z
